{
  "phase": "7",
  "phaseObjective": "Auth, evidence, matching, privacy, and operations on the real AWS backend. ALL 11 SLICES NOW COMPLETE. Slice 10 (load, quota, reserved concurrency, SLO) closed 2026-08-28 and was the last outstanding item. PHASE 7 PASSED IS NOT YET DECLARED: the work sits on branch phase7/slice10-reserved-concurrency-slo pending merge to main and final post-merge verification, and the phrase is deliberately withheld until then. Slice 10 evidence: the Lambda concurrent-executions restriction of 10 that blocked every previous attempt was a new-account restriction, not the AWS default; it has been lifted to the default of 1000, which is sufficient. The separate request to raise it to 1001 shows CASE_CLOSED and was never granted, and did not need to be. Reserved concurrency of 5 was applied to the 37 currently-deployed TEST functions via lambda:PutFunctionConcurrency rather than Terraform, because the aws_lambda_function resource carries filename and source_code_hash alongside reserved_concurrent_executions and any apply touching them would also have redeployed 37 Lambda bundles, which was not authorized. Terraform remains the declared desired configuration and its 44 sites read var.lambda_reserved_concurrency. Live reservation is 185 of 1000 with 815 unreserved; the eventual committed TEST configuration is 221 with 779 unreserved, the difference being the 8 functions not yet deployed plus verification_reminder_job at the scheduled-job module default of 1. Verified independently after the change: 37/37 at reservation 5, 37/37 CodeSha256 unchanged, 37/37 LastModified unchanged, no unapproved function reserved. The first probe attempt was UNMEASURED, not a failed SLO: all 25 requests died in local DNS resolution and it is preserved unaltered at docs/evidence/slice10-probe-unmeasured-dns-2026-08-28.json (sha256 9f86de4fb99cda6cd55d3435658cad10996714fdd6ee1614d4411d2c9d87f4f2). The second and only valid measurement passed every threshold: 25/25 HTTP 200, zero 429, zero 5xx, zero timeouts, zero network errors, p50 387ms, p95 1159ms, max 1207ms, evidence sha256 ea2ea549c7b3eea93b953e1002baa9fa3ddbfdc19b5b78ba3a6289f496211744. Production remains untouched throughout. Known and deliberately out of scope: 8 committed functions remain undeployed to TEST, and a full terraform apply currently also contains those additions, a code redeployment of 37 bundles, and an unrelated CI deploy-role IAM policy change.",
  "exactSuccessPhrase": "PHASE 7 PASSED",
  "utcTime": "2026-09-10T14:30:00Z",
  "toolVersions": {
    "git": "2.53.0.windows.2",
    "gh": "2.97.0",
    "node": "24.19.0",
    "npm": "11.17.0",
    "terraform": "1.15.8",
    "awsCli": "2.36.23",
    "claudeCode": "2.1.233",
    "winget": "1.29.280",
    "docker": "29.2.1 (present, not required, not used)"
  },
  "checks": [
    {
      "name": "Windows edition/build readable",
      "status": "WARN",
      "detail": "Windows 11 Home 10.0.22631 (23H2) confirmed locally; live Microsoft lifecycle page fetch failed (ETIMEOUT), support-window not independently re-confirmed. See docs/SOURCES.md."
    },
    {
      "name": "Claude Code version / doctor",
      "status": "PASS",
      "detail": "2.1.233, doctor reports no installation issues."
    },
    {
      "name": "/goal availability (requires 2.1.139+)",
      "status": "PASS",
      "detail": "Installed 2.1.233 exceeds threshold."
    },
    {
      "name": "/loop availability",
      "status": "PASS",
      "detail": "loop skill present in this environment."
    },
    {
      "name": "--continue/--resume support",
      "status": "PASS",
      "detail": "Both flags present in claude --help output."
    },
    {
      "name": "winget available",
      "status": "PASS",
      "detail": "v1.29.280."
    },
    {
      "name": "git required tool",
      "status": "PASS",
      "detail": "2.53.0.windows.2."
    },
    {
      "name": "gh required tool",
      "status": "PASS",
      "detail": "2.97.0, authenticated to the intended personal account (see docs/FOUNDER_READINESS.md)."
    },
    {
      "name": "Node.js LTS + npm required tool",
      "status": "PASS",
      "detail": "24.19.0 confirmed as current Active LTS via nodejs.org; npm 11.17.0."
    },
    {
      "name": "Terraform with S3-native lock support",
      "status": "PASS",
      "detail": "1.15.8 installed. Phase 5 confirmed live via WebFetch (developer.hashicorp.com/terraform/language/backend/s3): use_lockfile is current/non-deprecated, requires >= 1.10, DynamoDB-based locking is the deprecated path. Prior PENDING status resolved — see docs/SOURCES.md."
    },
    {
      "name": "AWS CLI v2 required tool",
      "status": "PASS",
      "detail": "2.36.23."
    },
    {
      "name": "Docker not installed/used",
      "status": "PASS",
      "detail": "Present pre-existing on machine; not installed by this session; not used."
    },
    {
      "name": "ANTHROPIC_API_KEY not set",
      "status": "PASS",
      "detail": "Confirmed unset without printing any value."
    },
    {
      "name": "Resolved project path is exactly Documents\\zoryvex, not a symlink",
      "status": "PASS",
      "detail": "Verified via PowerShell LinkType (empty = regular directory) and pwd."
    },
    {
      "name": "Repo/folder state inspected, no unexpected files",
      "status": "PASS",
      "detail": "Only prior v4.8 binding commit content present; no project-level MCP config yet."
    },
    {
      "name": "AWS Identity Center live state",
      "status": "PENDING",
      "detail": "SSO session for zoryvex-admin expired; only a silenced pass/fail probe is permitted (see docs/FOUNDER_READINESS.md); not required until AWS is actually touched (still not touched — no terraform apply this phase either)."
    },
    {
      "name": "Cognito conflict between Prompt 0 text and ADR 0001",
      "status": "WARN",
      "detail": "Resolved: ADR 0001 controls, documented in docs/COST_GUARDRAILS.md, docs/DECISIONS.md, docs/RISK_REGISTER.md. Recurred identically in Prompt 5's own text (Cognito User Pool + JWT authorizer) and resolved the same way — see the Phase 5 checks below."
    },
    {
      "name": "Phase 0 overall gate",
      "status": "PASS",
      "detail": "PHASE 0 PASSED — all required tool/path checks PASS, non-blocking WARN/PENDING items recorded, zero BLOCKED."
    },
    {
      "name": "Phase 1 Section 1 — CLAUDE",
      "status": "PASS",
      "detail": "Claude Code 2.1.233 confirmed, doctor clean."
    },
    {
      "name": "Phase 1 Section 2 — GitHub",
      "status": "PASS",
      "detail": "GitHub Free plan confirmed; repo settings verified read-only via gh api; matches target."
    },
    {
      "name": "Phase 1 Section 3 — AWS",
      "status": "PASS",
      "detail": "Root MFA/no access keys/alternate contacts confirmed; Identity Center/SSO verified working; billing/cost protections (budget, anomaly monitor) confirmed reused, not duplicated."
    },
    {
      "name": "Phase 1 Section 4 — Vercel domain registrar",
      "status": "PASS",
      "detail": "Registrar/nameserver state verified; no DNS records touched; no Vercel project created."
    },
    {
      "name": "Phase 1 Section 5 — Paystack",
      "status": "PASS",
      "detail": "Live mode confirmed, Starter Business, payouts enabled, business isolation confirmed. No live checkout/plan/key change made."
    },
    {
      "name": "Phase 1 Section 6 — Contact assets",
      "status": "PASS",
      "detail": "WhatsApp/LinkedIn links validated; founder photo processed and metadata-stripped, publication timing later resolved in Phase 4."
    },
    {
      "name": "Phase 2 - Five MCP capabilities",
      "status": "PASS",
      "detail": "21st/GitHub/Filesystem/Context7/Playwright configured at project scope, verified, none committed."
    },
    {
      "name": "Phase 3 - Foundation, guardrails, decision docs, CI gate",
      "status": "PASS",
      "detail": "Monorepo scaffold, static-export invariant, secret scanner, license check, PreToolUse safety hook, and ci.yml all in place and green (PR #1, #2)."
    },
    {
      "name": "Phase 4 - Complete local product",
      "status": "PASS",
      "detail": "Full public marketing site, safe-shell variant, candidate app, employer app, founder/admin console, all against packages/local-adapters. 88/88 Playwright + 79/79 Vitest green. No AWS, no real Paystack/SES touched. Landed via PR #4-#11."
    },
    {
      "name": "Phase 5 - CURRENT-DOC GATE research",
      "status": "PASS",
      "detail": "Live-verified (WebFetch/WebSearch, not memory): Terraform S3-native locking (use_lockfile, >=1.10); CloudFront $0 flat-rate plan has no Terraform provider support (open issue #45450, unmerged PR #49235) and doesn't bundle WAF on the Free tier either — both recorded in docs/adr/0003; AWS WAFv2 pricing ($5/ACL + $1/rule + $0.60/M requests); GuardDuty Malware Protection for S3 has no fixed idle charge, plus its exact IAM trust/permissions policy quoted from the live AWS doc; aws_dynamodb_table.deletion_protection_enabled behavior; terraform-provider-aws current version (6.60.0, within pinned ~> 6.0); CloudWatch alarm pricing (10 free, then $0.10/alarm-month). All rows added to docs/SOURCES.md with retrieval dates. This environment's plain CLI (terraform/curl/git) still cannot reach registry.terraform.io/developer.hashicorp.com directly (re-confirmed, same as Phase 0/3) but the assistant's WebFetch/WebSearch tools reached the public internet reliably throughout — noted in docs/SOURCES.md for future phases."
    },
    {
      "name": "Phase 5 - No-Cognito conflict recurrence, resolved",
      "status": "PASS",